rewrite_query_EN,md5,Oai,Google,perplexity
Analyze the causes of occupational burnout syndrome among teachers and healthcare workers.,1895c177d2b62fa946638cc53aa92ef2,,Yuhao,
How to prevent and treat eczema through diet and exercise,55f3a1e66d134ae8a5e275b5a125c7d8,,Yuhao,
"Provide a classification of the research topics of Nobel Prize winners in Economics, analyze all awarded works,.",f0166aa6e34fc9372fc12150fbae83bb,,Yuhao,
"Small startup teams with limited budgets need an all-in-one TV that can be used for meetings and also serve as a display for promotion, suitable for placement at the reception desk, next to products, or beside storefront windows. What are the available options?",6716e16cde8d82552490e7079ff92228,Zhonghang,Zhonghang,Zhonghang
"I need a basic fertilizer that contains the following components: Nitrogen 4%, Phosphorus 2.3%, Potassium 3%, Calcium 1%, Iron, Manganese, Copper, Zinc each 0.01%. The types of fertilizers include calcium nitrate, potassium sulfate, potassium bicarbonate, and trace element fertilizers. If using all the above fertilizers to prepare a solution suitable for planting chickpeas and achieving maximum growth and yield, please calculate the grams of each fertilizer that should be added per liter of solution.",c5231bb623baba656800d1998d5e6221,Zhonghang,Zhonghang,Zhonghang
Study 20 leading DEXs and select the three safest and most profitable liquidity pools for the Ethereum/USDC pair.,ff5a4dda0252f3fbd2f2476068ee38ed,Zhonghang,Zhonghang,Zhonghang
"How to launch an online-only new women's clothing brand in Europe, the United States, and Australia. Research modern direct-to-consumer brands launched during or after the pandemic and their strategies, analyze and provide practical and immediately applicable digital marketing strategies, including real-world case studies.",38f70df01ceda4c15c87493225083f19,Zhonghang,Zhonghang,Zhonghang
What is the secret of the Bermuda Triangle and the reason for its mystery?,0876c76feaddee9cad9fa8cd8428348d,Zhonghang,Zhonghang,Zhonghang
Report on the Impact of Undiagnosed Generalized Anxiety Disorder on Children's Learning,1d7a5208f58a55d9a43d449ec8314115,Xinchen,Xinchen,Xinchen
Summarize recent research progress on reinforcement learning in the use of tools by LLMs.,9fb65b12df21ae73d660489db93a2f37,Xinchen,Xinchen,Xinchen
Market Research on Furniture for Small Apartments in Hong Kong and Analysis of Market Entry Strategies,4cf5da60f0695a084a2f7e65c1747540,Xinchen,Xinchen,Xinchen
"How to build a gamified system for mathematics teaching, focusing on the alignment of knowledge graphs and game skill trees, and secondly, studying the learning difficulty curve in games. Analyze the reasons why games are engaging while learning is comparatively less so, and how high-difficulty games (such as 'Dark Souls') manage to keep players continuously engaged.",12db074e7ba8dc57e6092c7437cc7862,Xinchen,Xinchen,Xinchen
"Develop a framework or summary of economic turning points and their driving factors, including leading and lagging indicators, and combine analysis and existing research, focusing on Canada, the United States, and the United Kingdom.",4b062ceaf34809f231a9677d352433be,Xinchen,Xinchen,Xinchen
"How can the education sector apply artificial intelligence technology in enterprises, which groups benefit, and in what specific ways do they benefit?",a297a9e6dbe75f49a3ce2d5349033e90,Jiale,Jiale,Jiale
Create a market research report on China's AI cloud computing power market.,4ec417a6c62dfa15c99e4bf0fca4ded7,Jiale,Jiale,Jiale
"What is the field of study of ethics? What are the disciplinary perspectives, core issues, key concepts, important theories, main schools of thought, and representative figures of ethics?",20a02a6ac301c4740913125da1757cfd,Jiale,Jiale,Jiale
"Investigate whether Yordles in League of Legends truly die when they suffer fatal damage, i.e., whether Yordles possess immortality characteristics, and if immortality does exist, what its specific mechanism of operation is.",c54a4aa37ff9c542261d711731909c15,Jiale,Jiale,Jiale
Analyze the practice-oriented activities of communicative general learning activities for students in the basic education stage based on the collective academic dialogue techniques of literature reading classes.,0cb72362a38245569d992026a3c5c417,Jiale,Jiale,
,,,,
,,,,
