rewrite_query_EN,md5,Oai,Google,perplexity
"Analyze the interaction between biological factors (such as hormones, chromosomes, and brain development) and social and cultural influences in shaping gender behavior and identity. Critically assess how scientific understanding has evolved from deterministic views (e.g., early 20th-century theories on innate gender roles) to more complex interactional models that emphasize the interplay of nature and environment. Focus on key areas such as toy preferences, gender identity, intersex conditions, and brain plasticity. Evaluate the current state of knowledge and ongoing debates by integrating the latest empirical research, meta-analyses, and interdisciplinary perspectives (including neuroscience, psychology, sociology, and gender studies).",6bfc66ae3815d0a8dae6989d2575281d,Yumeng,Yumeng,Tianyu
"Explores the synthesis of a novel cationic porphyrin containing four cationic quaternary ammonium groups and its potential in antimicrobial applications. The research approach combines the antibacterial performance of quaternary ammonium salts (stemming from the cationic ammonium centers) with the bacterial photobiological inactivation triggered by porphyrin as a photosensitizer (aPDT). The proposed novel cationic porphyrin is designed to serve as a potential photosensitizer for aPDT, capable of eliminating microorganisms under light exposure and exhibiting antibacterial effects in dark conditions due to the characteristics of quaternary ammonium salts. This material can be used for treating bacterial surfaces.",5efb378ed2163579007e834ac87b4ede,Yumeng,Yumeng,Tianyu
"Comprehensive analysis of the challenges faced by large language models (LLMs) in accurately interpreting legal norms while responding to user queries, with a focus on studying the effectiveness of retrieval-augmented generation (RAG) services in retrieving relevant passages from well-annotated legal knowledge bases.",cf6f6d6543860bc6279b54838d863dca,Yumeng,Yumeng,Tianyu
How to purify a membrane transport protein and achieve functional analysis through artificial liposome reconstruction.,b817ed665ba0af74ac62354c10f71347,Yumeng,Yumeng,Tianyu
"Explore methods for analyzing EEG signals, summarize all possible approaches, and generate a matrix. Summarize the calculation formulas, detailed principles, physical significance of the results, application scenarios, and algorithm categories (time domain, frequency domain, time-frequency domain) of each algorithm or EEG signal analysis method. Conclude which methods are suitable for brain-computer interface and visual occipital region analysis.",85c8212676f39b3a1dcfb982dabc124e,Yumeng,Yumeng,Tianyu
"Conduct AI-assisted training tasks for dragon boat rowing, plan to collect data through sensors or machine vision methods, and then train deep learning models. Please provide the types of data to be collected, recommended equipment to be used, and how to utilize this data to train models to help improve competition performance.",c9d9517c70eaf607de60de4916ffff13,Yumeng,Yumeng,Tianyu
"The current research and industrialization status of solid-state lithium batteries, including their theoretical and practical advantages compared to traditional batteries, the main challenges faced in laboratory research and mass production, the estimated timeline for application, and other potential competing technologies.",8b811b2e04de45baf11feab4d8c5707d,Yumeng,Yumeng,Tianyu
"Analysis of the impact of quantum computing on traditional encryption and antivirus techniques and corresponding countermeasures, including the basic principles of quantum computing, the impact of quantum computing on traditional encryption technologies, the role of antivirus software in resisting quantum computing, how antivirus software addresses encryption and decryption issues brought by quantum computing, as well as viruses and trojans empowered by quantum computing.",7917b02496804037e4409b1870b06baf,Yumeng,Yumeng,Tianyu
"What mature methods are available for product managers to learn AI knowledge? What experiences have well-known AI product leaders or CEOs (such as OpenAI, MidJourney, Claude, Heygen, Manus, etc.) shared in terms of uncovering user needs and creating excellent AI product methodologies?",f41e1a973c40a49baee6c49f6dbaa652,Yumeng,Yumeng,Tianyu
"The study examines the working mechanism of lithium cobalt oxide as the cathode in lithium-ion batteries, with graphite as the anode and lithium hexafluorophosphate as the electrolyte.",4f7520ec3e940db5e5a3da4173ab6dfa,Yumeng,Yumeng,Tianyu
"The system understands the knowledge of the principles of seismic sources in geophysics. The outline includes the basic theory of seismic sources, inversion methods (waveform, full waveform inversion), and analytical tools (such as beach balls, stress diagrams), among others.",2b4180243578cc8648ccbbe07c94cb49,Lingxuan,Lingxuan,Lingxuan
"Conduct a comprehensive search and understanding of detailed information related to the teaching-free laser welding robot, including product introductions, market acceptance, recognized advantages by the market, etc.; focus on introducing the detailed specifics, advantages, quality, and competitive strengths of the welding arm.",e0063d5bb23b329a905da045e2fcdf63,Lingxuan,Lingxuan,Lingxuan
"Analyze the monster, elite, and boss system of 'Diablo' to uncover why it can continuously attract players to grind and maintain high engagement. Dive into the mysteries behind it, specifically researching aspects such as the types, quantity, categories, stats, loot, and skills of the monsters, and provide comprehensive data to guide independent game developers in designing game systems.",86319026eb6a4dcc97aabf6adedb9fea,Lingxuan,Lingxuan,Lingxuan
"What mathematical foundation is required for conducting research in machine learning and deep learning, and how to find the best quality resources online to quickly complete the learning of artificial intelligence mathematics foundations.",49ded7177cf3ee9152fe8725507a70fe,Lingxuan,Lingxuan,Lingxuan
"The essence of Multiple Imputation, especially explained from a Bayesian perspective; the advantages and limitations of complete case analysis, particularly whether CCA is unbiased when used to estimate regression coefficients for categorical outcome variables.",76384af4e3417c17ab2231ce3793ad83,Lingxuan,Lingxuan,Lingxuan
"Understand the latest developments in various fields of embodied intelligence, including reports from leading companies such as Google and Physical Intelligent, as well as papers published in top journals and conferences.",469fe2687872f906adf60f5fe98630e6,Hanqing,Hanqing,Hanqing
Write a review on the role of cytochrome complexes in the initial reactions of photosynthesis.,cebe02de03a96d6efd65d406969a72ca,Hanqing,Hanqing,Hanqing
"The complete process of hybrid breeding of winter wheat, from parent selection to offspring screening, covering specific operational steps in both laboratory and field management, including common techniques, time nodes, and key control points.",1263dead13f8a8a426f36dafd3b328bc,Hanqing,Hanqing,Hanqing
"Comprehensively explain the following topics: Introduction to Laser, Laser Physics, Laser Principles, Basics of Laser, Laser Theory and Operation, Laser Components, Laser Elements, Laser Characteristics.",bf9e99353ef4c7e8accb87057357b80e,Hanqing,Hanqing,Hanqing
In-depth study of the microbial diversity of Juniperus plants and extraction of information on their potential value in biotechnology applications from scientific papers.,f81e39a17750175e0b300e0df6034c97,Hanqing,Hanqing,Hanqing
"How can the improvement of reasoning ability in large language models through reinforcement learning be explained, as well as the Grokking phenomenon observed in models after SFT?",ab6f416c031c1b519be8934ef68d3223,Lingrui,Lingrui,Lingrui
"The effect of bulk ultrasonic treatment on metal and magnesium alloy grain boundaries, and the structural transformation model of magnesium alloy after ultrasonic treatment.",7efccd746d8f2c52c20296ac71807b6f,Lingrui,Lingrui,Lingrui
"Description of the biochemical composition characteristics of brown algae, as well as the species found in the Barents Sea and White Sea regions and their uses and purposes.",f4babdc555140f7ea4fbd09acc0b07e8,Lingrui,Lingrui,Lingrui
"Evaluate the performance of chitosan and sodium alginate microcapsule shells in terms of Novec 1230 vapor permeability at 25 degrees Celsius, and analyze the effects of different cross-linking options.",8463299af879f298250b35357f6c2796,Lingrui,Lingrui,Lingrui
"Why are sensitivity and specificity important in T-cell antigen recognition, and what mechanisms can achieve sensitivity and specificity?",b8faa7f9d7c17e08ce573c7af17d329c,Lingrui,Lingrui,Lingrui
Why are the high-frequency components of brain electrical signals detected on the scalp significantly weaker than intracranial signals?,499a50592f257278dc33e7e99cbaa64c,Tianyu,Tianyu,Tianyu
Is the factor limiting the maximum distance of human astronomical observation the vastness of space or the fact that the universe has existed for only 13.7 billion years?,5fe43f657034ad0a9f29d089a9564adf,Tianyu,Tianyu,Tianyu
"Detailed analysis of the typing speed of various Chinese character input methods, including Double Pinyin, Wubi, and Pinyin.",666af26c66d938d116f6084f32a67504,Tianyu,Tianyu,Tianyu
"Introduction to methods related to multi-robot formation cluster control (including principles, preferably with formulas).",3d5c3dd0980d288ab632380c37f81063,Tianyu,Tianyu,Tianyu
"The construction of the YOLO v8 model, its improvements compared to previous versions, and a comparative analysis with other similar models",cc2392ccdf1cbd4d10b6edecca5a1b74,Tianyu,Tianyu,Tianyu
"Key findings of a comprehensive study on the pyrolysis of pecan shells for the preparation of biochar, focusing on the analysis of the effects of pyrolysis temperature on biochar yield, specific surface area (BET), porosity, surface functional groups (analyzed through FTIR/XPS), degree of graphitization (via Raman spectroscopy ID/IG ratio), and electrical conductivity, as well as listing typical reported values or ranges for these properties. An analysis was conducted on biochar suitable for electrical or sensing applications, comparing the most commonly used characterization techniques (SEM, Raman spectroscopy, FTIR, BET, four-probe conductivity measurement, TGA) to explain the specific information provided by each technique.",f6509c64f085e3d24613056af63abe6c,Yuhao,Yuhao,Yuhao
"A study on Marvin Minsky's ideas, particularly his book 'The Society of Mind,' is conducted alongside a parallel study of Francisco Varela, focusing on analyzing the criticisms of his embodied mind theory and the different types of artificial intelligence advocated in his work. Finally, conclusions are drawn through the research and the trends in the development of artificial intelligence are observed, analyzing whether they align more closely with Minsky's or Varela's views, and to what extent this alignment should occur.",af2a68da9cce472cef0fe9ef574737c3,Yuhao,Yuhao,Yuhao
"As an economic analysis researcher with a background in public economics and public management, it is necessary to take Singapore's economy as the research focus, study its development, characteristics, causal analysis, and provide insights for the development of the Guangdong-Hong Kong-Macao Greater Bay Area.",08fdc7534a4f3398ec798f9a38844d8a,Yuhao,Yuhao,Yuhao
Which financial asset has consistently grown over the past 100 years without experiencing significant sharp declines?,65e2fb8401aecc2fcef1013aeb46b8cb,Yuhao,Yuhao,Yuhao
"Please explain the emerging research in the field of receptor pharmacology, focusing on the following areas: taste GPCRs, receptor dimerization, allosteric effects, cAMP and mood disorders, microdomains, opioids and 5-HTA biased agonists, psychedelic drugs for mental disorders, lithium and novel drugs for bipolar disorders, cAMP cardiac drugs鈥攅specially different PDE isoenzymes.",3b082586d614ef01655c508b42f68410,Yuhao,Yuhao,Yuhao
"Is it feasible to implement a dimming system simulating natural light for broiler chickens starting on the day of hatch? This system includes 16 hours of lighting with gradually dimming light, 6 hours of complete darkness, and 1 hour of gradually intensifying light to simulate sunset and sunrise effects.",d4d92bafdbd64ce8b9ea96c9cc753e78,Yuhao,Yuhao,Yuhao
"LDL performs multiple functions in the human body. Some suggest that excessively lowering its levels might have adverse effects on health. Moreover, research indicates that elderly individuals with higher LDL or total cholesterol levels tend to have lower overall mortality rates. Further investigation into issues related to this LDL level is desired.",e15023eb7b9f7e751a2cf35e0ffe60ca,Yuhao,Yuhao,Yuhao
"From the perspective of increasing underwater breath-holding time and endurance (anaerobic work frequency), analyze the respiratory system development of synchronized swimming athletes in different age groups of girls (7-12 years old, 13-15 years old, and over 15 years old).",b6fc9d3b32f3cb8337cdc763086e93fb,Yuhao,Yuhao,Yuhao
What is the definition of a psychologically mature personality? What are the assessment criteria? What methods or steps can be used to achieve it? What techniques can be used to diagnose the current state and reach the ideal state?,6cca54b8e313a129852902bfde0a137e,Yuhao,Yuhao,Yuhao
Randomized Controlled Trial Protocol on the Impact of Drinking Matcha and Chamomile Tea on the Severity of Primary Dysmenorrhea,c36249d9dcd7ded7da74e56a74086d77,Yuhao,Yuhao,Yuhao
What are the main differences between sertraline and escitalopram? Why would a doctor choose to prescribe one medication over the other based on the patient's condition? Please compare the two in terms of their effects on causing drowsiness and nausea.,e0c103d81e295c66a9857b23a013359c,xubin,xubin,xubin
"The absorption characteristics of various types of Omega-3 fatty acids, including herring, mackerel, ethyl esters, and triglycerides, as well as analysis of administration methods and their reasons.",e93322351b65bfc2266d5a9197ed975b,xubin,xubin,xubin
"Research on the booming box office of horror movies in the context of the economic recession in the United States during the 1970s to 1980s, including the connections and underlying causes.",933c4545024b1e871586564daee9112f,xubin,xubin,xubin
The Role and Powers of the Court in the Pretrial Stage of Criminal Proceedings,df62e9e967fdf43d4112258aaa5fed51,xubin,xubin,xubin
"Analyze the relationship between gaze and power based on Foucault's theory of panoramic prison, elucidate their interactions, and delve deeply into the illusion of freedom.",6410f00fbb9c281e893b1fad02a90c57,xubin,xubin,xubin
Research on urban commuting difficulty is conducted based on the ratio of average commuting distance to the built-up area of the city.,45d8e93d63a263853d36b99029bfc5b7,Lingxuan,Lingxuan,Lingxuan
"Conduct a systematic, comprehensive, and in-depth analysis of Lincoln's role in the Civil War and complete the related research report.",3a6f5321868afb24193d6755ff10a551,Lingxuan,Lingxuan,Lingxuan
"Prepare an academic report on the historical development of neoliberalism, including its background, the main contents of neoliberalist thought, and its political impact in the real world. Conduct an in-depth analysis of the nature and causes of neoliberalism, and elaborate on its evolution in contemporary society.",815a6c68ee5afaeed07ee802ad2ef15a,Lingxuan,Lingxuan,Lingxuan
"What are the main schools of thought in the study of intellectual history? It is known that there are the Cambridge School and the Strauss School, but what other schools are there? What are the characteristics of their methods in studying intellectual history?",580c851d2017b9e4c68c55be84f1e5e8,Lingxuan,Lingxuan,Lingxuan
"Write a comprehensive and informative article covering all aspects of medieval cats and dogs, including culture, mythology, legends, fictional stories, superstitions, as well as interesting facts and tales, and examine historical sources related to these topics.",c320543008bd1d6a7c73a10c23113aaa,Lingxuan,Lingxuan,Lingxuan
"Conduct a comprehensive analysis of all the films directed by Feng Xiaogang, evaluate the overall quality and level of his works, and provide a complete ranking along with detailed reasons and analysis.",5b4bd876fd6ea2576932ca9b33d216da,Hanqing,Hanqing,Hanqing
Write a comprehensive article on the topic 'Body and Attention: The Phenomenology of Embodiment.',5d81b964cfc7614ad813ce3e94044519,Hanqing,Hanqing,Hanqing
"In today's era, with the significant lowering of the threshold for photography, how can we construct an evaluation system to distill the essence of the times from numerous photographic works?",da03fdf28783b9feaaa57c1ab5f91b83,Hanqing,Hanqing,Hanqing
"Provide a detailed study of the personal life and work of French composer and pianist C茅cile Chaminade, including her anecdotes and true stories.",49df990eccc0af01633da1668810552b,Hanqing,Hanqing,Hanqing
"Design a magic system in a novel where magic users are called 'trazadores.' They use special chalk and follow Python-like logic to write code on surfaces or bodies, thereby altering the physical laws of anything they touch. The magic system of 'trazadores' should be coherent and convincing, and can draw inspiration from the magic systems in 'The Rithmatist' or the 'Mistborn' series.",1a8a0f298d51cacf8e18d14bfe3c883c,Hanqing,Hanqing,Hanqing
"Detailed commentary on the first verse of the first chapter to the sixth chapter of the 'Śrīmad Bhāgavatam', analyzing the connection between the chapters.",ccaba433b353235dc93812c00594c299,,Lingrui,Lingrui
"Based on information from the internet, analyze the key stages in Maxim Gorky's works that reflect literary naturalism, explore the possible influence of the connection between Russian and European literature on the emergence of naturalism as a literary movement, and apply these studies to Gorky's works and intellectual exploration.",458cc341e4cec2f77ffecaadf4f08d53,,Lingrui,Lingrui
"Research all currency information in the 'The Legend of Heroes' series, including the currency Mira in the 'Trails' series, as well as detailed information about the currency and its control and issuance mechanisms.",9c5013268d1e7e3e295a93d5afbdacd5,,Lingrui,Lingrui
"A complete, unique, and professional in-depth guide to 'Fortnite' tailored for ranked players, covering expert advice, key tips and pitfalls, overall rotation mechanics, and the best ways to use currently popular items and loot.",424b118861ca0806eeb344e12a6896c2,,Lingrui,Lingrui
"Analysis of the current status of the LoveLive! project, including the current situation and development status of each group, the planning and assessment of the groups' future, current fans' perspectives, evaluations, and opinions on the project, as well as the project's future development direction and the possibility of regaining its brilliance.",c344484da2be877c9fea4152a26c3407,,Lingrui,Lingrui
"Query all information related to the background story and skins of Teemo Omega Squad, including data on other characters under this theme.",814deb08e1f67c64c591b412f6a3b73d,Yangqin,Yangqin,Yangqin
"Investigate the history of the 'Zelda' series and explain the story of 'Tears of the Kingdom' in a simple and easy-to-understand way for those who are unfamiliar with gaming history, making it comprehensible even to non-fans.",9aeb743169ebe5b7a009072cb2f5c541,Yangqin,Yangqin,Yangqin
"Since the construction of the wind tunnel, McLaren F1 team's aerodynamic design level has continuously improved. Why has such a significant breakthrough been achieved in just a few years? By the F1 races up to 2025, McLaren cars have demonstrated a clear advantage compared to other teams, even surpassing the competitiveness of Red Bull Racing's Max Verstappen in his Red Bull car. Analyze the reasons for McLaren's success and its advantages in specific aspects.",d9e64fdad1554b9a55b0d90178f2b087,Yangqin,Yangqin,Yangqin
"Find a racket with a large sweet spot, preferring a solid hitting feel.",650539e7b2c9102359d46a2331c64526,Yangqin,Yangqin,Yangqin
"Studying the taste of Armenian brandy, focusing on consumers' experiences during tasting, without involving history or the production process.",498a9cd210d2174775a9da698e8bbe5c,Yangqin,Yangqin,Yangqin
"As the primary meat source for cat food, compared to chicken, goose, duck, and rabbit meat, what are the specific differences and advantages of pigeon meat in meeting the nutritional needs of cats? Please provide a detailed comparison.",5e4d0c26a93d41aded74cf36f0e75076,,Yumeng,Yumeng
"Conduct in-depth research and search for the best men's perfumes suitable for hot weather, focusing on those with the longest-lasting scent, the widest projection range (beast mode), the highest durability, and a fresh fragrance.",e99bed2c7afe8f496239bb6b0c420c04,,Yumeng,Yumeng
"List all the rules and details about the use of lighting, including the angle of incidence, distance, height of the light source, and the relationship between the size of the light source and the object. Specify the specific scenarios and reasons for use. Additionally, analyze the relative position of the camera and light source, as well as their purpose and reasons for use.",ad3e6848a29f2966366cb04b767acf1c,,Yumeng,Yumeng
"Analyze the principles of making kebabs from the physical and chemical perspective and develop an alternative method to the traditional kebab-making process. Available tools include a gas stove, pot, frying pan, grater; materials are not limited.",81e0dba5c205673e8d348dad923b700d,,Yumeng,Yumeng
How can large language models (LLMs) be effectively quantized and optimized?,cd83b983d25c6940a70c27af5f0fa1b5,,Yumeng,Yumeng
"Study of a physical system: One end of a string is fixed to a pivot, and the pivot undergoes vertical simple harmonic vibration. Two identical small balls are suspended at each end of the string, and the system has two degrees of freedom: the angle of the string and the rotation angle of the small balls. Air resistance causing damping and the restitution coefficient of incomplete elastic deformation need to be considered. First, a general analysis of the system is carried out to predict the motion patterns, followed by model simplification and theoretical analysis for different phases of motion.",4d30bfed346995a1ee3de0fcb1cc7f94,,Yumeng,Yumeng
This study aims to analyze the economic contribution of the fisheries industry to the Gross Domestic Product (GDP) of Canada's Atlantic region and its role in sustaining the livelihoods of coastal communities. The research includes: (1) the direct and indirect employment impacts generated by the fisheries; (2) the role of ecological changes (such as fish population fluctuations and climate change) on economic stability; (3) the effects of government regulations and market changes on income and employment; (4) the economic diversification and adaptive strategies of fishing communities in response to challenges.,a9dd0d32eefc9a17c1930c8f8479a07f,,Yumeng,Yumeng
What exactly American residents are consuming to achieve such a high consumption / GDP ratio?,0d6618c6a8265675c8f0ebbe400723d2,,Yumeng,Yumeng
"In-depth research on the working principles of the METS algorithm, analyzing specific information about its audience, positioning, and creativity, and discussing how to use appropriate creative strategies to more effectively reach the target audience.",5f34d52d14f7028e5f60ab0b38dcf8ad,,Yumeng,Yumeng
"How can the principles of self-determination theory, particularly the promotion of autonomy, competence, and relatedness, be effectively integrated into teacher professional development programs to enhance the ability of elementary educators to design and implement culturally responsive reading instruction strategies, thereby stimulating the intrinsic motivation and reading engagement of students from low socioeconomic backgrounds?",1d027c86821d50eede312e8d4195bca6,,Yumeng,Yumeng
"Design a 7-day itinerary for Banff and the surrounding areas in Canada. On the first day, depart from Toronto to Calgary and stay one night in Calgary; the rest of the itinerary can be arranged freely.",dd39d0144b4cf3fe4e6d597d52ba1a2a,,Yuhao,Yuhao
"Children's cognitive development and learning. In terms of developmental psychology, it includes stages of cognitive development (Piaget, Vygotsky), children's attention and memory; in terms of learning theory, it includes game-based learning, constructivism, meaningful learning; attention and concentration topics.",515b7d11523bc514267cce93fce87d15,,Yuhao,Yuhao
"How to make money by scanning the Zero Data Cores and videos in 'EVE: Void'? In which systems do the Zero Data Cores and videos appear, and which are more valuable?",c6931e11d06275de9e00c1816c0eac78,,Yuhao,Yuhao
"Real gas models beyond the Van der Waals model, detailed explanation of their historical background, derivation process, theoretical rationality, and limitations.",0b6546d8eb8ea9048175be8d0c8faed8,,Yuhao,
What are the similarities and differences between the political and legal systems of the Roman Empire and the Eastern Roman Empire?,8cbe654cb0c32df12b71032e7ce29ad3,,Yuhao,
"Provide information about refractory materials in the iron and steel manufacturing industry, including their types, chemical composition, relevant compliance standards, importance, testing standards, key performance indicators, their reaction with different molten steel chemical compositions, and relevant content that helps understand and evaluate their quality and suitability for different applications.",5a91cc7607118a64c58c7031400c93c0,,Yuhao,
The legends of 'The Elder Scrolls' are arranged in chronological order by year and era.,eaaf04dcbb79c7f2600d85fb1ced15a9,,Yuhao,
